### ISSUE TITLE
prometheus cannot scrape data from node-exporter on controllers

### ISSUE THREAD

**Issue by surajssd** [kinvolk/lokomotive#117]
This cluster is installed on Packet platform.

Prometheus cannot scrape node-exporter running on the controller node. So here are the node-exporters running in the cluster:

```console
$ kubectl get pods -o wide | grep node-exporter
NAME                                                 READY   STATUS      RESTARTS   AGE     IP           NODE                               NOMINATED NODE   READINESS GATES
prometheus-operator-prometheus-node-exporter-4rvcd   1/1     Running     0          6h21m   10.88.81.3   suraj-lk-cluster-controller-0      <none>           <none>
prometheus-operator-prometheus-node-exporter-dn5cs   1/1     Running     0          6h21m   10.88.81.1   suraj-lk-cluster-pool-1-worker-0   <none>           <none>
prometheus-operator-prometheus-node-exporter-swk5b   1/1     Running     0          6h21m   10.88.81.5   suraj-lk-cluster-pool-1-worker-1   <none>           <none>
prometheus-operator-prometheus-node-exporter-t8qbn   1/1     Running     0          6h21m   10.88.81.7   suraj-lk-cluster-pool-1-worker-2   <none>           <none>
```

You can see that the node-exporter running on the node `suraj-lk-cluster-controller-0` has IP `10.88.81.3`.

```console
$ kubectl get pods -o wide | grep prometheus-prometheus-operator-prometheus-0
NAME                                                     READY   STATUS      RESTARTS   AGE     IP           NODE                               NOMINATED NODE   READINESS GATES
prometheus-prometheus-operator-prometheus-0              3/3     Running     1          6h20m   10.2.51.7    suraj-lk-cluster-pool-1-worker-1   <none>           <none>
```

From the above output we can see that prometheus pod is running on node `suraj-lk-cluster-pool-1-worker-1` and now if I ssh into the node and run from node `suraj-lk-cluster-pool-1-worker-1` following:

```console
$ curl 10.88.81.3:9100/metrics
curl: (7) Failed to connect to 10.88.81.3 port 9100: Connection timed out
```

Clearly the traffic is blocked.

Most probably this is blocked in calico policies.

### Quick reference:

* Controller node IP: `10.88.81.3`
* Node running prometheus: `10.88.81.5`

---

Packet capture from controller node `suraj-lk-cluster-controller-0`:

```console
# tcpdump -n tcp port 9100 and host 10.88.81.5
dropped privs to tcpdump
tcpdump: verbose output suppressed, use -v or -vv for full protocol decode
listening on enp0s20f0, link-type EN10MB (Ethernet), capture size 262144 bytes
14:14:13.150383 IP 10.88.81.5.2175 > 10.88.81.3.9100: Flags [S], seq 1333681074, win 28800, options [mss 1440,sackOK,TS val 1068054948 ecr 0,nop,wscale 7], length 0
14:14:16.336511 IP 10.88.81.5.42364 > 10.88.81.3.9100: Flags [S], seq 911574427, win 29200, options [mss 1460,sackOK,TS val 730577808 ecr 0,nop,wscale 7], length 0
14:14:17.374316 IP 10.88.81.5.42364 > 10.88.81.3.9100: Flags [S], seq 911574427, win 29200, options [mss 1460,sackOK,TS val 730578846 ecr 0,nop,wscale 7], length 0
14:14:19.422321 IP 10.88.81.5.42364 > 10.88.81.3.9100: Flags [S], seq 911574427, win 29200, options [mss 1460,sackOK,TS val 730580894 ecr 0,nop,wscale 7], length 0
14:14:23.454322 IP 10.88.81.5.42364 > 10.88.81.3.9100: Flags [S], seq 911574427, win 29200, options [mss 1460,sackOK,TS val 730584926 ecr 0,nop,wscale 7], length 0
14:14:31.774331 IP 10.88.81.5.42364 > 10.88.81.3.9100: Flags [S], seq 911574427, win 29200, options [mss 1460,sackOK,TS val 730593245 ecr 0,nop,wscale 7], length 0
14:14:36.054806 IP 10.88.81.5.18078 > 10.88.81.3.9100: Flags [S], seq 2444645047, win 28800, options [mss 1440,sackOK,TS val 1068077852 ecr 0,nop,wscale 7], length 0
14:14:37.086339 IP 10.88.81.5.18078 > 10.88.81.3.9100: Flags [S], seq 2444645047, win 28800, options [mss 1440,sackOK,TS val 1068078883 ecr 0,nop,wscale 7], length 0
14:14:39.134365 IP 10.88.81.5.18078 > 10.88.81.3.9100: Flags [S], seq 2444645047, win 28800, options [mss 1440,sackOK,TS val 1068080931 ecr 0,nop,wscale 7], length 0
14:14:43.166362 IP 10.88.81.5.18078 > 10.88.81.3.9100: Flags [S], seq 2444645047, win 28800, options [mss 1440,sackOK,TS val 1068084963 ecr 0,nop,wscale 7], length 0
```

From above you can see that packets come from the prometheus on worker node to node-exporter on controller node but nothing goes back.

Controller node `suraj-lk-cluster-controller-0` can scrape all nodes' node-exporter without issues. Scraping self:

```console
$ curl --silent 10.88.81.3:9100/metrics | head -5

# HELP go_gc_duration_seconds A summary of the GC invocation durations.
# TYPE go_gc_duration_seconds summary
go_gc_duration_seconds{quantile="0"} 1.655e-05
go_gc_duration_seconds{quantile="0.25"} 4.0558e-05
go_gc_duration_seconds{quantile="0.5"} 6.6279e-05
```

Scraping node-exporter on the host `suraj-lk-cluster-pool-1-worker-1` from controller `suraj-lk-cluster-controller-0`:

```console
$ curl --silent 10.88.81.5:9100/metrics | head -5 

# HELP go_gc_duration_seconds A summary of the GC invocation durations.
# TYPE go_gc_duration_seconds summary
go_gc_duration_seconds{quantile="0"} 2.7107e-05
go_gc_duration_seconds{quantile="0.25"} 7.1412e-05
go_gc_duration_seconds{quantile="0.5"} 0.000118606
```

**Comment by surajssd** [comment]
Fixed in https://github.com/kinvolk/lokomotive/pull/201
